{
  "$schema": "http://json-schema.org/draft-07/schema#",
  "$id": "https://example.org/schema/person.schema.json",
  "title": "Person",
  "description": "A type designer or other professional involved in creating typefaces, digital or pre-digital.",
  "type": "object",
  "additionalProperties": false,
  "required": [
    "id",
    "slug",
    "name",
    "roles",
    "sources",
    "record_status",
    "created_at",
    "updated_at"
  ],
  "properties": {
    "id": {
      "type": "string",
      "pattern": "^rtd-p-[0-9]{6}$",
      "description": "Permanent opaque identifier. Never reused, never changed once assigned."
    },
    "slug": {
      "type": "string",
      "pattern": "^[a-z0-9]+(-[a-z0-9]+)*$",
      "description": "URL/filename-friendly slug. May change if a record is renamed; id does not."
    },
    "previous_slugs": {
      "type": "array",
      "items": { "type": "string", "pattern": "^[a-z0-9]+(-[a-z0-9]+)*$" },
      "default": [],
      "description": "Slugs this record used to have before being renamed. The build emits a redirect stub page at each old URL pointing at the current one, so old links keep working. Append the old slug here whenever you change `slug`, never remove an entry once added."
    },
    "name": {
      "type": "object",
      "additionalProperties": false,
      "required": ["preferred"],
      "properties": {
        "preferred": { "type": "string", "minLength": 1 },
        "alternates": {
          "type": "array",
          "items": { "type": "string", "minLength": 1 },
          "default": []
        },
        "native": {
          "type": "array",
          "items": {
            "type": "object",
            "additionalProperties": false,
            "required": ["value", "script"],
            "properties": {
              "value": { "type": "string", "minLength": 1 },
              "script": { "type": "string", "minLength": 1 },
              "language": { "type": "string", "pattern": "^[a-z]{2,3}(-[A-Za-z0-9]{2,8})*$" }
            }
          },
          "description": "The name written in its own script(s), as found in a source."
        }
      }
    },
    "sort_name": {
      "type": "string",
      "description": "Name form used for alphabetical listing, useful for non-Latin or family-name-first names."
    },
    "birth_year": {
      "type": "string",
      "description": "Free-form to allow uncertain precision, e.g. '1901' or 'c. 1890'."
    },
    "death_year": {
      "type": "string"
    },
    "countries": {
      "type": "array",
      "items": { "type": "string" },
      "default": []
    },
    "roles": {
      "type": "array",
      "minItems": 1,
      "items": { "type": "string", "minLength": 1 },
      "description": "e.g. type designer, punchcutter, calligrapher, type engineer."
    },
    "active_years": {
      "type": "object",
      "additionalProperties": false,
      "properties": {
        "start": { "type": "string" },
        "end": { "type": "string" }
      }
    },
    "scripts": {
      "type": "array",
      "items": { "type": "string" },
      "default": [],
      "description": "Writing systems worked in."
    },
    "affiliations": {
      "type": "array",
      "default": [],
      "items": {
        "type": "object",
        "additionalProperties": false,
        "required": ["name"],
        "properties": {
          "name": { "type": "string", "minLength": 1 },
          "start_year": { "type": "string" },
          "end_year": { "type": "string" },
          "id": { "type": "string", "pattern": "^rtd-o-[0-9]{6}$", "description": "The organisation record, when there is one." }
        }
      }
    },
    "gender": {
      "type": "string",
      "minLength": 1
    },
    "place_of_birth": {
      "type": "string",
      "minLength": 1
    },
    "place_of_death": {
      "type": "string",
      "minLength": 1
    },
    "alma_mater": {
      "type": "array",
      "default": [],
      "items": { "type": "string", "minLength": 1 }
    },
    "positions_held": {
      "type": "array",
      "default": [],
      "items": {
        "type": "object",
        "additionalProperties": false,
        "required": ["title"],
        "properties": {
          "title": { "type": "string", "minLength": 1 },
          "start_year": { "type": "string" },
          "end_year": { "type": "string" }
        }
      }
    },
    "bio": {
      "type": "string",
      "maxLength": 1000,
      "description": "Short plain-text summary, a few sentences. Not a full biography."
    },
    "external_ids": {
      "type": "object",
      "additionalProperties": false,
      "properties": {
        "wikidata_qid": { "type": "string", "pattern": "^Q[0-9]+$" },
        "viaf": { "type": "string", "description": "VIAF cluster id, digits only." },
        "isni": { "type": "string", "description": "ISNI, 16 digits, spaces optional." },
        "lc_naf": { "type": "string", "description": "Library of Congress/NACO Authority File id, e.g. 'n79021164'." },
        "gnd": { "type": "string", "description": "GND (Gemeinsame Normdatei / Deutsche Nationalbibliothek) id." },
        "worldcat_entity": { "type": "string", "description": "OCLC WorldCat Entity id, the string after id.oclc.org/worldcat/entity/. Note: the WorldCat.org detail page for an entity currently prompts for a library-affiliated login to view, unlike the other authority files here, still worth recording as a cross-reference even though the page itself isn't always freely browsable." },
        "ulan": { "type": "string", "pattern": "^[0-9]+$", "description": "Getty Union List of Artist Names (ULAN) numeric id, e.g. '500104874'. A cross-reference only. A ULAN record page may also be cited in sources[]." }
      },
      "description": "Informational cross-references only, one per authority file. Never usable as a sources entry."
    },
    "sources": {
      "type": "array",
      "items": {
        "type": "object",
        "additionalProperties": false,
        "required": ["url", "title"],
        "properties": {
          "url": { "type": "string", "format": "uri" },
          "title": { "type": "string", "minLength": 1 },
          "type": {
            "type": "string",
            "enum": ["book", "book chapter", "journal article", "thesis", "conference paper", "newspaper or magazine", "interview", "type specimen", "foundry or publisher page", "font catalogue", "designer website", "archive or museum record", "standards document", "reference website", "government document", "community publication", "audio or video", "software repository", "other"],
            "description": "What kind of document this is. Descriptive only."
          },
          "language": {
            "type": "string",
            "pattern": "^[a-z]{2,3}(-[A-Za-z0-9]{2,8})*$",
            "description": "Language of the source, as a BCP 47 tag (e.g. en, or, sat, hi, ar)."
          },
          "date": { "type": "string", "description": "Publication date as given by the source (YYYY, YYYY-MM or YYYY-MM-DD)." },
          "publisher": { "type": "string", "minLength": 1 },
          "archive_url": { "type": "string", "format": "uri", "description": "An archived copy of url, e.g. on web.archive.org." }
        }
      },
      "description": "Independent, verifiable sources. Must never be Wikidata, Wikipedia, or any Wikimedia project, enforced by scripts/validate.js."
    },
    "contributed_by": {
      "type": "array",
      "default": [],
      "items": {
        "type": "object",
        "additionalProperties": false,
        "required": ["name"],
        "properties": {
          "name": { "type": "string", "minLength": 1 },
          "type": { "type": "string", "enum": ["individual", "institution"], "default": "individual" },
          "url": { "type": "string", "format": "uri" }
        }
      },
      "description": "Who submitted or substantially contributed this record's entry - distinct from the record's own subject. The first entry is treated as the record's citation author (see site-templates/shared.js buildCitations). Auto-filled with the submitter's GitHub username for issue-form submissions; add by hand when opening a PR directly, see CONTRIBUTING.md. Also powers the /contributors/ page. Omit entirely for records researched and entered by the registry's own maintainers - the citation falls back to the default maintainer credit in that case."
    },
    "verification_status": {
      "type": "string",
      "enum": ["verified", "needs_verification"],
      "default": "verified",
      "description": "Set to needs_verification when sources are thin or low-confidence (e.g. a bare LinkedIn profile) rather than omitting the record entirely. Absent/'verified' means sources are considered solid."
    },
    "record_status": {
      "type": "string",
      "enum": ["active", "merged", "deprecated"]
    },
    "superseded_by": {
      "type": ["string", "null"],
      "pattern": "^rtd-p-[0-9]{6}$"
    },
    "created_at": { "type": "string", "format": "date" },
    "updated_at": { "type": "string", "format": "date" }
  }
}
