{
  "id": "rtd-p-000106",
  "slug": "steve-jackaman",
  "name": {
    "preferred": "Steve Jackaman",
    "alternates": []
  },
  "countries": [],
  "roles": [
    "type designer"
  ],
  "sources": [
    {
      "url": "http://www.HouseofType.com",
      "title": "www.houseoftype.com"
    },
    {
      "url": "https://d-nb.info/gnd/141108886",
      "title": "GND / Integrated Authority File",
      "type": "archive or museum record",
      "publisher": "Deutsche Nationalbibliothek"
    }
  ],
  "record_status": "active",
  "superseded_by": null,
  "created_at": "2026-08-07",
  "updated_at": "2026-10-08",
  "external_ids": {
    "wikidata_qid": "Q133718968",
    "viaf": "120353166",
    "isni": "0000000077915082",
    "gnd": "141108886"
  },
  "birth_year": "1954"
}
