{
  "id": "rtd-p-000193",
  "slug": "arlette-boutros",
  "name": {
    "preferred": "Arlette Boutros",
    "alternates": []
  },
  "roles": ["type designer"],
  "scripts": ["Arabic"],
  "bio": "Heads the Boutros Group with Mourad Boutros, working in Arabic typography, calligraphy and design. Co-designed the Beiruti typeface.",
  "sources": [
    { "url": "https://fonts.google.com/specimen/Beiruti/about", "title": "Beiruti - Google Fonts", "type": "font catalogue", "language": "en", "publisher": "Google Fonts" }
  ],
  "record_status": "active",
  "superseded_by": null,
  "created_at": "2026-10-10",
  "updated_at": "2026-10-10"
}
