{
  "id": "rtd-p-000113",
  "slug": "wim-crouwel",
  "name": {
    "preferred": "Wim Crouwel",
    "alternates": []
  },
  "countries": [
    "Netherlands"
  ],
  "roles": [
    "type designer"
  ],
  "sources": [
    {
      "url": "https://www.dutchgraphicroots.nl/wim-crouwel-2/",
      "title": "www.dutchgraphicroots.nl",
      "type": "reference website",
      "publisher": "Dutch Graphic Roots",
      "archive_url": "https://web.archive.org/web/20260519062754/https://www.dutchgraphicroots.nl/wim-crouwel-2/"
    },
    {
      "url": "https://hdl.handle.net/21.12141/id/people.30dd6a2b-f013-4211-9b3d-0e61128884e2",
      "title": "hdl.handle.net"
    },
    {
      "url": "https://a-g-i.org/user/wimcrouwel/",
      "title": "a-g-i.org",
      "type": "reference website",
      "publisher": "Alliance Graphique Internationale",
      "archive_url": "https://web.archive.org/web/20240525054739/https://a-g-i.org/user/wimcrouwel/"
    },
    {
      "url": "https://www.lastdodo.nl/nl/areas/108313",
      "title": "www.lastdodo.nl"
    },
    {
      "url": "https://www.postzegelontwerpen.nl/postzegels/ontwerpen/crouwel-wilm-hendrik-wim",
      "title": "www.postzegelontwerpen.nl",
      "archive_url": "https://web.archive.org/web/20241229053239/https://www.postzegelontwerpen.nl/postzegels/ontwerpen/crouwel-wilm-hendrik-wim"
    },
    {
      "url": "https://www.stedelijk.nl/nl/collectie/23481-wim-crouwel-compositie-b",
      "title": "Compositie B",
      "type": "archive or museum record",
      "publisher": "Stedelijk Museum Amsterdam",
      "archive_url": "https://web.archive.org/web/20250624222025/https://www.stedelijk.nl/nl/collectie/23481-wim-crouwel-compositie-b"
    },
    {
      "url": "https://theaterencyclopedie.nl/wiki/Wim_Crouwel",
      "title": "theaterencyclopedie.nl",
      "archive_url": "https://web.archive.org/web/20241229053031/https://theaterencyclopedie.nl/wiki/Wim_Crouwel"
    },
    {
      "url": "https://www.nu.nl/amsterdam/5995586/grafisch-ontwerper-wim-crouwel-90-overleden.html",
      "title": "Grafisch ontwerper Wim Crouwel (90) overleden - NU.nl",
      "archive_url": "https://web.archive.org/web/20230810225218/https://www.nu.nl/amsterdam/5995586/grafisch-ontwerper-wim-crouwel-90-overleden.html"
    },
    {
      "url": "https://www.tellerreport.com/news/2019-09-19---graphic-designer-wim-crouwel-(90)-passed-away-.SJV5DKWPB.html",
      "title": "Graphic designer Wim Crouwel (90) passed away - Teller Report",
      "archive_url": "https://web.archive.org/web/20240702061414/https://www.tellerreport.com/news/2019-09-19---graphic-designer-wim-crouwel-(90)-passed-away-.SJV5DKWPB.html"
    }
  ],
  "record_status": "active",
  "superseded_by": null,
  "created_at": "2026-08-07",
  "updated_at": "2026-10-19",
  "external_ids": {
    "wikidata_qid": "Q555389",
    "viaf": "96546526",
    "isni": "0000000092024835",
    "lc_naf": "n50018512",
    "gnd": "118996169",
    "worldcat_entity": "E39PBJrm7cyXv7yr9v67hhkRrq",
    "ulan": "500008765"
  },
  "birth_year": "1928-11-21",
  "death_year": "2019-09-19",
  "place_of_birth": "Groningen",
  "place_of_death": "Amsterdam"
}
