{
  "id": "rtd-p-000048",
  "slug": "sijya-gupta",
  "name": { "preferred": "Sijya Gupta", "alternates": [] },
  "countries": ["India"],
  "roles": ["type designer", "graphic designer"],
  "bio": "Designed Hedra, a seven-style typeface published by the Indian Type Foundry. NID Ahmedabad graduate; independent designer working across identity, motion graphics, and digital art in New Delhi.",
  "external_ids": { "wikidata_qid": "Q125430700" },
  "sources": [
    { "url": "https://www.indiantypefoundry.com/designers/sijya-gupta", "title": "Sijya Gupta - Indian Type Foundry", "type": "foundry or publisher page", "publisher": "Indian Type Foundry" },
    { "url": "https://thedesignkids.org/interviews/sijya-gupta/", "title": "Sijya Gupta - The Design Kids" }
  ],
  "record_status": "active",
  "superseded_by": null,
  "created_at": "2026-08-05",
  "updated_at": "2026-10-08"
}
