{
  "id": "rtd-p-000172",
  "slug": "munshi-mangal-singh-masaram",
  "name": {
    "preferred": "Munshi Mangal Singh Masaram",
    "alternates": ["Mangal Singh Masaram"]
  },
  "countries": ["India"],
  "roles": ["script inventor"],
  "scripts": ["Masaram Gondi"],
  "bio": "Created the Masaram Gondi script in 1918 to write Gondi. He was from Kochewada in Balaghat district, Madhya Pradesh.",
  "sources": [
    { "url": "https://www.omniglot.com/writing/masaramgondi.htm", "title": "Masaram Gondi Script", "type": "reference website", "language": "en", "publisher": "Omniglot", "archive_url": "https://web.archive.org/web/20260726202323/https://www.omniglot.com/writing/masaramgondi.htm" },
    { "url": "https://www.omniglot.com/writing/gondi.htm", "title": "Gondi languages and alphabets", "type": "reference website", "language": "en", "publisher": "Omniglot", "archive_url": "https://web.archive.org/web/20261006225339/https://www.omniglot.com/writing/gondi.htm" }
  ],
  "record_status": "active",
  "superseded_by": null,
  "created_at": "2026-10-06",
  "updated_at": "2026-10-08"
}
