{
  "id": "rtd-p-000214",
  "slug": "fiona-ross",
  "name": {
    "preferred": "Fiona Ross",
    "alternates": []
  },
  "roles": ["type designer"],
  "scripts": ["Arabic", "Bangla", "Devanagari", "Gurmukhi", "Thai"],
  "bio": "Type designer, author and consultant working on Arabic, South Asian and Thai scripts, and Professor in Type Design at the University of Reading.",
  "sources": [
    { "url": "https://fonts.google.com/specimen/Tiro+Bangla/about", "title": "Tiro Bangla - Google Fonts", "type": "font catalogue", "language": "en", "publisher": "Google Fonts" },
    { "url": "https://fonts.google.com/specimen/Gulzar/about", "title": "Gulzar - Google Fonts", "type": "font catalogue", "language": "en", "publisher": "Google Fonts" }
  ],
  "record_status": "active",
  "superseded_by": null,
  "created_at": "2026-10-10",
  "updated_at": "2026-10-10"
}
