{
  "id": "rtd-p-000011",
  "slug": "kalapi-gajjar-bordawekar",
  "name": { "preferred": "Kalapi Gajjar-Bordawekar", "alternates": ["Kalapi Gajjar"] },
  "countries": ["India"],
  "roles": ["type designer", "font engineer"],
  "affiliations": [
    { "name": "Universal Thirst", "id": "rtd-o-000036", "start_year": "2016" },
    { "name": "Monotype", "id": "rtd-o-000022" },
    { "name": "Dalton Maag", "id": "rtd-o-000007" }
  ],
  "bio": "Type designer and font engineer focused on writing systems of the Indian subcontinent. Worked at Monotype and Dalton Maag before co-founding Universal Thirst with Gunnar Vilhjálmsson in 2016.",
  "external_ids": { "wikidata_qid": "Q113568817" },
  "sources": [
    { "url": "https://typenetwork.com/font-designers/kalapi-gajjar", "title": "Kalapi Gajjar - Type Network", "type": "font catalogue", "publisher": "Type Network", "archive_url": "https://web.archive.org/web/20250518033222/https://typenetwork.com/font-designers/kalapi-gajjar" },
    { "url": "https://www.typotheque.com/authors/kalapi-gajjar-bordawekar", "title": "Kalapi Gajjar-Bordawekar - Typotheque", "type": "foundry or publisher page", "publisher": "Typotheque", "archive_url": "https://web.archive.org/web/20260525065553/https://www.typotheque.com/authors/kalapi-gajjar-bordawekar" },
    { "url": "https://granshan.com/person/kalapi-gajjar-bordawekar", "title": "Kalapi Gajjar-Bordawekar - GRANSHAN", "archive_url": "https://web.archive.org/web/20260414002622/https://granshan.com/person/kalapi-gajjar-bordawekar" },
    { "url": "https://www.itsnicethat.com/articles/universal-thirst-graphic-design-141119", "title": "Universal Thirst - It's Nice That", "type": "newspaper or magazine", "publisher": "It's Nice That", "archive_url": "https://web.archive.org/web/20241108153505/https://www.itsnicethat.com/articles/universal-thirst-graphic-design-141119" }
  ],
  "record_status": "active",
  "superseded_by": null,
  "created_at": "2026-08-05",
  "updated_at": "2026-10-19"
}
