{
  "id": "rtd-p-000224",
  "slug": "hani-alasadi",
  "name": {
    "preferred": "Hani Alasadi",
    "alternates": ["Hani AbdulAmir"]
  },
  "countries": ["United Arab Emirates"],
  "roles": ["type designer"],
  "scripts": ["Arabic"],
  "bio": "Hani Alasadi (Hani AbdulAmir) is a creative director and graphic designer based in Dubai, focusing on typography and type design. Designed the Badeen Display typeface.",
  "sources": [
    { "url": "https://fonts.google.com/specimen/Badeen+Display/about", "title": "Badeen Display - Google Fonts", "type": "font catalogue", "language": "en", "publisher": "Google Fonts" },
    { "url": "https://fonts.adobe.com/designers/hani-alasadi", "title": "Hani Alasadi | Adobe Fonts", "type": "font catalogue", "language": "en", "publisher": "Adobe Fonts" }
  ],
  "record_status": "active",
  "superseded_by": null,
  "created_at": "2026-10-10",
  "updated_at": "2026-10-10"
}
