{
  "id": "rtd-p-000038",
  "slug": "yesha-goshar",
  "name": {
    "preferred": "Yesha Goshar",
    "alternates": []
  },
  "countries": ["India"],
  "roles": ["type designer", "graphic designer"],
  "affiliations": [
    { "name": "Ek Type", "id": "rtd-o-000010" }
  ],
  "bio": "Type and graphic designer at Ek Type, Mumbai. Designed Anek Latin and Anek Odia, contributed to Honk and Baloo 2's Odia script, and advised on the Chapakala19 Odia revival typeface.",
  "external_ids": { "wikidata_qid": "Q113686759" },
  "sources": [
    { "url": "https://fontsinuse.com/type_designers/8527/yesha-goshar", "title": "Yesha Goshar - Fonts In Use", "type": "reference website", "publisher": "Fonts In Use", "archive_url": "https://web.archive.org/web/20251009201852/https://fontsinuse.com/type_designers/8527/yesha-goshar" },
    { "url": "https://www.typotheque.com/authors/yesha-goshar", "title": "Yesha Goshar - Typotheque", "type": "foundry or publisher page", "publisher": "Typotheque", "archive_url": "https://web.archive.org/web/20251116042918/https://www.typotheque.com/authors/yesha-goshar" }
  ],
  "record_status": "active",
  "superseded_by": null,
  "created_at": "2026-08-05",
  "updated_at": "2026-10-19"
}
