{
  "id": "rtd-p-000100",
  "slug": "ray-larabie",
  "name": {
    "preferred": "Ray Larabie",
    "alternates": []
  },
  "countries": [],
  "roles": [
    "type designer"
  ],
  "sources": [
    {
      "url": "http://www.typodermic.com",
      "title": "www.typodermic.com",
      "type": "foundry or publisher page",
      "publisher": "Typodermic Fonts"
    },
    {
      "url": "https://d-nb.info/gnd/143394657",
      "title": "GND / Integrated Authority File",
      "type": "archive or museum record",
      "publisher": "Deutsche Nationalbibliothek"
    }
  ],
  "record_status": "active",
  "superseded_by": null,
  "created_at": "2026-08-07",
  "updated_at": "2026-10-08",
  "external_ids": {
    "wikidata_qid": "Q6104700",
    "viaf": "165545463",
    "isni": "0000000113363044",
    "gnd": "143394657",
    "worldcat_entity": "E39PBJhxqYt64hhFGDGMY4KTpP"
  },
  "birth_year": "1970"
}
